{
  "$schema": "https://json-schema.org/draft/2020-12/schema",
  "$id": "https://course.invalid/schemas/restaurant-site-manifest-v5-1.json",
  "title": "Restaurant Website V5.1 public package manifest",
  "type": "object",
  "additionalProperties": false,
  "required": [
    "schema_version",
    "site_name",
    "business_type",
    "public_domain",
    "package_version",
    "build_date",
    "stage",
    "workflow_version",
    "system_version",
    "business_assets_version",
    "repository_package_spec",
    "design_lock_reference",
    "final_approval_reference",
    "primary_action",
    "pages",
    "external_media",
    "public_documents",
    "forms"
  ],
  "properties": {
    "schema_version": {"type": "string", "const": "2.0"},
    "site_name": {"type": "string", "minLength": 1, "maxLength": 120, "pattern": ".*\\S.*"},
    "business_type": {"type": "string", "enum": ["restaurant", "food-establishment"]},
    "public_domain": {"type": "string", "format": "https-origin", "maxLength": 255},
    "package_version": {
      "type": "string",
      "minLength": 1,
      "maxLength": 64,
      "pattern": "[A-Za-z0-9][A-Za-z0-9._-]*"
    },
    "build_date": {"type": "string", "format": "date-time", "maxLength": 40},
    "stage": {"type": "string", "enum": ["starter", "production"]},
    "workflow_version": {"type": "string", "pattern": "5\\.1(?:\\.[0-9]+)?", "maxLength": 16},
    "system_version": {
      "type": "string",
      "minLength": 1,
      "maxLength": 64,
      "pattern": "[A-Za-z0-9][A-Za-z0-9._-]*"
    },
    "business_assets_version": {
      "type": "string",
      "minLength": 1,
      "maxLength": 64,
      "pattern": "[A-Za-z0-9][A-Za-z0-9._-]*"
    },
    "repository_package_spec": {"type": "string", "const": "5.1"},
    "design_lock_reference": {
      "type": "string",
      "minLength": 1,
      "maxLength": 128,
      "pattern": "[A-Za-z0-9][A-Za-z0-9._:-]*"
    },
    "final_approval_reference": {
      "type": "string",
      "minLength": 1,
      "maxLength": 128,
      "pattern": "[A-Za-z0-9][A-Za-z0-9._:-]*"
    },
    "primary_action": {
      "type": "object",
      "additionalProperties": false,
      "required": ["label", "url"],
      "properties": {
        "label": {"type": "string", "minLength": 1, "maxLength": 80, "pattern": ".*\\S.*"},
        "url": {"type": "string", "format": "action-url", "maxLength": 2048}
      }
    },
    "pages": {
      "type": "array",
      "minItems": 1,
      "uniqueItems": true,
      "items": {
        "type": "object",
        "additionalProperties": false,
        "required": ["path", "title"],
        "properties": {
          "path": {"type": "string", "format": "relative-site-path", "maxLength": 255},
          "title": {"type": "string", "minLength": 1, "maxLength": 120, "pattern": ".*\\S.*"}
        }
      }
    },
    "external_media": {
      "type": "array",
      "uniqueItems": true,
      "items": {
        "type": "object",
        "additionalProperties": false,
        "required": ["id", "kind", "url", "page", "purpose", "accessibility", "owner_approved"],
        "properties": {
          "id": {"type": "string", "pattern": "[a-z0-9][a-z0-9-]*", "maxLength": 64},
          "kind": {
            "type": "string",
            "enum": ["direct-video", "cloudflare-stream", "youtube", "vimeo", "large-download"]
          },
          "url": {"type": "string", "format": "https-url", "maxLength": 2048},
          "page": {"type": "string", "format": "relative-site-path", "maxLength": 255},
          "purpose": {"type": "string", "minLength": 1, "maxLength": 240, "pattern": ".*\\S.*"},
          "poster": {"type": "string", "format": "relative-site-path", "maxLength": 255},
          "accessibility": {"type": "string", "minLength": 1, "maxLength": 400, "pattern": ".*\\S.*"},
          "owner_approved": {"type": "boolean"}
        }
      }
    },
    "public_documents": {
      "type": "array",
      "uniqueItems": true,
      "items": {
        "type": "object",
        "additionalProperties": false,
        "required": ["id", "path", "page", "purpose", "owner_approved"],
        "properties": {
          "id": {"type": "string", "pattern": "[a-z0-9][a-z0-9-]*", "maxLength": 64},
          "path": {"type": "string", "format": "relative-site-path", "maxLength": 255},
          "page": {"type": "string", "format": "relative-site-path", "maxLength": 255},
          "purpose": {"type": "string", "minLength": 1, "maxLength": 240, "pattern": ".*\\S.*"},
          "owner_approved": {"type": "boolean"}
        }
      }
    },
    "forms": {
      "type": "array",
      "uniqueItems": true,
      "items": {
        "type": "object",
        "additionalProperties": false,
        "required": ["id", "enabled", "action", "page", "purpose", "fallback", "privacy_page", "turnstile_action"],
        "properties": {
          "id": {"type": "string", "pattern": "[a-z0-9][a-z0-9-]*", "maxLength": 64},
          "enabled": {"type": "boolean"},
          "action": {"type": "string", "const": "/api/contact"},
          "page": {"type": "string", "format": "relative-site-path", "maxLength": 255},
          "purpose": {"type": "string", "minLength": 1, "maxLength": 160, "pattern": ".*\\S.*"},
          "fallback": {"type": "string", "format": "action-url", "maxLength": 2048},
          "privacy_page": {"type": "string", "format": "relative-site-path", "maxLength": 255},
          "turnstile_action": {
            "type": "string",
            "pattern": "[A-Za-z0-9_-]+",
            "minLength": 1,
            "maxLength": 32
          }
        }
      }
    }
  }
}
