{
  "schema_version": "2.0",
  "site_name": "Restaurant Website Starter",
  "business_type": "restaurant",
  "public_domain": "https://restaurant-starter-shell.pages.dev",
  "package_version": "starter-5.1.0",
  "build_date": "2026-08-28T12:00:00Z",
  "stage": "starter",
  "workflow_version": "5.1",
  "system_version": "restaurant-system-pack-5.1",
  "business_assets_version": "restaurant-business-assets-5.1",
  "repository_package_spec": "5.1",
  "design_lock_reference": "starter-shell",
  "final_approval_reference": "starter-shell",
  "primary_action": {
    "label": "View setup status",
    "url": "/setup-status.html"
  },
  "pages": [
    {
      "path": "index.html",
      "title": "Restaurant Website Publishing System Ready"
    },
    {
      "path": "setup-status.html",
      "title": "Restaurant Website Infrastructure Status"
    },
    {
      "path": "404.html",
      "title": "Page Not Found | Restaurant Website Starter"
    },
    {
      "path": "menu.html",
      "title": "Menu Not Loaded | Restaurant Website Starter"
    },
    {
      "path": "contact.html",
      "title": "Contact Not Loaded | Restaurant Website Starter"
    },
    {
      "path": "privacy.html",
      "title": "Privacy Page Not Loaded | Restaurant Website Starter"
    }
  ],
  "external_media": [],
  "public_documents": [],
  "forms": []
}
